{
  "active_rules": [
    "OPENC-MODULE-DUPLICATE-001",
    "OPENC-MODULE-MAPPING-001",
    "OPENC-MODULE-MULTISOURCE-001",
    "OPENC-MODULE-ORDER-001",
    "OPENC-OVERLOAD-EXACT-001"
  ],
  "evidence_state": "EXECUTED_PASS_WINDOWS_X86_64_1_0",
  "expected": {
    "class": "valid",
    "edition": "OpenC Core 1.0 Current",
    "environment": "hosted",
    "expected": {
      "result": "accept"
    },
    "fixture_kind": "multi-source",
    "mode": "module",
    "modules": {
      "app": [
        "a.p",
        "b.p"
      ]
    },
    "name": "module_multi_source_overload",
    "profile": "standard",
    "rules": [
      "OPENC-MODULE-DUPLICATE-001",
      "OPENC-MODULE-MAPPING-001",
      "OPENC-MODULE-MULTISOURCE-001",
      "OPENC-MODULE-ORDER-001",
      "OPENC-OVERLOAD-EXACT-001"
    ]
  },
  "id": "valid/module_multi_source_overload",
  "kind": "valid",
  "origin": "OpenC Standard Draft 0.10 validation/valid/module_multi_source_overload",
  "schema": "openc.fixture.v1",
  "source_files": [
    "conformance/fixtures/valid/module_multi_source_overload/sources/a.p",
    "conformance/fixtures/valid/module_multi_source_overload/sources/b.p"
  ]
}
