{
  "active_rules": [
    "OPENC-FUNCTION-DIRECT-001",
    "OPENC-GRAMMAR-AUTHORITY-001",
    "OPENC-GRAMMAR-COVERAGE-001",
    "OPENC-MODULE-IMPORT-001"
  ],
  "evidence_state": "EXECUTED_PASS_WINDOWS_X86_64_1_0",
  "expected": {
    "class": "valid",
    "edition": "OpenC Core 1.0 Current",
    "environment": "hosted",
    "expected": {
      "result": "accept"
    },
    "fixture_kind": "source",
    "name": "first_program",
    "profile": "standard",
    "rules": [
      "OPENC-FUNCTION-DIRECT-001",
      "OPENC-GRAMMAR-AUTHORITY-001",
      "OPENC-GRAMMAR-COVERAGE-001",
      "OPENC-MODULE-IMPORT-001"
    ]
  },
  "id": "valid/first_program",
  "kind": "valid",
  "origin": "OpenC Standard Draft 0.10 validation/valid/first_program",
  "schema": "openc.fixture.v1",
  "source_files": [
    "conformance/fixtures/valid/first_program/main.p"
  ]
}
