{
  "active_rules": [
    "OPENC-PTR-BINDING-MUTABLE-001",
    "OPENC-PTR-ONEPAST-001",
    "OPENC-PTR-SUBTRACT-001",
    "OPENC-TARGET-PTROFFSET-001"
  ],
  "evidence_state": "EXECUTED_PASS_WINDOWS_X86_64_1_0",
  "expected": {
    "class": "valid",
    "edition": "OpenC Core 1.0 Current",
    "environment": "hosted",
    "expected": {
      "result": "accept"
    },
    "fixture_kind": "source",
    "mode": "module",
    "name": "pointer_one_past_compare",
    "profile": "standard",
    "rules": [
      "OPENC-PTR-BINDING-MUTABLE-001",
      "OPENC-PTR-ONEPAST-001",
      "OPENC-PTR-SUBTRACT-001",
      "OPENC-TARGET-PTROFFSET-001"
    ]
  },
  "id": "valid/pointer_one_past_compare",
  "kind": "valid",
  "origin": "OpenC Standard Draft 0.10 validation/valid/pointer_one_past_compare",
  "schema": "openc.fixture.v1",
  "source_files": [
    "conformance/fixtures/valid/pointer_one_past_compare/main.p"
  ]
}
