{
  "active_rules": [
    "OPENC-EVAL-UNARY-001"
  ],
  "evidence_state": "EXECUTED_PASS_WINDOWS_X86_64_1_0",
  "expected": {
    "class": "runtime",
    "edition": "OpenC Core 1.0 Current",
    "environment": "hosted",
    "expected": {
      "result": "accept"
    },
    "fixture_kind": "runtime",
    "mode": "module",
    "name": "unary_operand_once",
    "profile": "standard",
    "rules": [
      "OPENC-EVAL-UNARY-001"
    ]
  },
  "id": "runtime/unary_operand_once",
  "kind": "runtime",
  "origin": "OpenC Standard Draft 0.10 validation/runtime/unary_operand_once",
  "schema": "openc.fixture.v1",
  "source_files": [
    "conformance/fixtures/runtime/unary_operand_once/main.p"
  ]
}
