{
  "active_rules": [
    "OPENC-OPTIONAL-PRESENT-001",
    "OPENC-OPTIONAL-VALUE-001"
  ],
  "evidence_state": "EXECUTED_PASS_WINDOWS_X86_64_1_0",
  "expected": {
    "class": "valid",
    "edition": "OpenC Core 1.0 Current",
    "environment": "hosted",
    "expected": {
      "result": "accept"
    },
    "fixture_kind": "source",
    "name": "optional_checked",
    "profile": "standard",
    "rules": [
      "OPENC-OPTIONAL-PRESENT-001",
      "OPENC-OPTIONAL-VALUE-001"
    ]
  },
  "id": "valid/optional_checked",
  "kind": "valid",
  "origin": "OpenC Standard Draft 0.10 validation/valid/optional_checked",
  "schema": "openc.fixture.v1",
  "source_files": [
    "conformance/fixtures/valid/optional_checked/main.p"
  ]
}
