{
  "active_rules": [
    "OPENC-TARGET-ALIGNOF-001",
    "OPENC-TARGET-ARRAYSIZE-001",
    "OPENC-TARGET-QUERYDOMAIN-001",
    "OPENC-TARGET-SIZEOF-001",
    "OPENC-TARGET-STORAGESIZE-001"
  ],
  "evidence_state": "EXECUTED_PASS_WINDOWS_X86_64_1_0",
  "expected": {
    "class": "valid",
    "edition": "OpenC Core 1.0 Current",
    "environment": "hosted",
    "expected": {
      "result": "accept"
    },
    "fixture_kind": "source",
    "mode": "module",
    "name": "type_size_alignment",
    "profile": "standard",
    "rules": [
      "OPENC-TARGET-ALIGNOF-001",
      "OPENC-TARGET-ARRAYSIZE-001",
      "OPENC-TARGET-QUERYDOMAIN-001",
      "OPENC-TARGET-SIZEOF-001",
      "OPENC-TARGET-STORAGESIZE-001"
    ]
  },
  "id": "valid/type_size_alignment",
  "kind": "valid",
  "origin": "OpenC Standard Draft 0.10 validation/valid/type_size_alignment",
  "schema": "openc.fixture.v1",
  "source_files": [
    "conformance/fixtures/valid/type_size_alignment/main.p"
  ]
}
