{
  "active_rules": [
    "OPENC-CONSTRUCT-001",
    "OPENC-CONSTRUCT-PLACEMENT-001",
    "OPENC-CONSTRUCT-VALUE-001",
    "OPENC-DESTROY-001",
    "OPENC-STORAGE-COMMIT-001",
    "OPENC-STORAGE-EMPTY-001"
  ],
  "evidence_state": "EXECUTED_PASS_WINDOWS_X86_64_1_0",
  "expected": {
    "class": "valid",
    "edition": "OpenC Core 1.0 Current",
    "environment": "hosted",
    "expected": {
      "result": "accept"
    },
    "fixture_kind": "source",
    "name": "typed_storage",
    "profile": "standard",
    "rules": [
      "OPENC-CONSTRUCT-001",
      "OPENC-CONSTRUCT-PLACEMENT-001",
      "OPENC-CONSTRUCT-VALUE-001",
      "OPENC-DESTROY-001",
      "OPENC-STORAGE-COMMIT-001",
      "OPENC-STORAGE-EMPTY-001"
    ]
  },
  "id": "valid/typed_storage",
  "kind": "valid",
  "origin": "OpenC Standard Draft 0.10 validation/valid/typed_storage",
  "schema": "openc.fixture.v1",
  "source_files": [
    "conformance/fixtures/valid/typed_storage/main.p"
  ]
}
