{
  "active_rules": [
    "OPENC-OPTIONAL-ASSIGN-001",
    "OPENC-OPTIONAL-COPY-001",
    "OPENC-OPTIONAL-NONE-001"
  ],
  "evidence_state": "EXECUTED_PASS_WINDOWS_X86_64_1_0",
  "expected": {
    "class": "valid",
    "edition": "OpenC Core 1.0 Current",
    "environment": "hosted",
    "expected": {
      "result": "accept"
    },
    "fixture_kind": "source",
    "mode": "module",
    "name": "optional_none_and_copy",
    "profile": "standard",
    "rules": [
      "OPENC-OPTIONAL-ASSIGN-001",
      "OPENC-OPTIONAL-COPY-001",
      "OPENC-OPTIONAL-NONE-001"
    ]
  },
  "id": "valid/optional_none_and_copy",
  "kind": "valid",
  "origin": "OpenC Standard Draft 0.10 validation/valid/optional_none_and_copy",
  "schema": "openc.fixture.v1",
  "source_files": [
    "conformance/fixtures/valid/optional_none_and_copy/main.p"
  ]
}
