{
  "active_rules": [
    "OPENC-EVAL-CALL-001",
    "OPENC-EXPR-ORDER-001",
    "OPENC-EXPR-PRECEDENCE-001"
  ],
  "evidence_state": "EXECUTED_PASS_WINDOWS_X86_64_1_0",
  "expected": {
    "class": "valid",
    "edition": "OpenC Core 1.0 Current",
    "environment": "hosted",
    "expected": {
      "result": "accept",
      "stdout": [
        "first",
        "second"
      ]
    },
    "fixture_kind": "source",
    "mode": "module",
    "name": "eval_call_left_to_right",
    "profile": "standard",
    "rules": [
      "OPENC-EVAL-CALL-001",
      "OPENC-EXPR-ORDER-001",
      "OPENC-EXPR-PRECEDENCE-001"
    ]
  },
  "id": "valid/eval_call_left_to_right",
  "kind": "valid",
  "origin": "OpenC Standard Draft 0.10 validation/valid/eval_call_left_to_right",
  "schema": "openc.fixture.v1",
  "source_files": [
    "conformance/fixtures/valid/eval_call_left_to_right/main.p"
  ]
}
