{
  "active_rules": [
    "OPENC-EVAL-ARGMODE-001",
    "OPENC-FUNCTION-ARGORDER-001"
  ],
  "evidence_state": "EXECUTED_PASS_WINDOWS_X86_64_1_0",
  "expected": {
    "class": "runtime",
    "edition": "OpenC Core 1.0 Current",
    "environment": "hosted",
    "expected": {
      "result": "accept",
      "stdout": [
        "1",
        "2"
      ]
    },
    "fixture_kind": "runtime",
    "mode": "module",
    "name": "function_arguments_left_to_right",
    "profile": "standard",
    "rules": [
      "OPENC-EVAL-ARGMODE-001",
      "OPENC-FUNCTION-ARGORDER-001"
    ]
  },
  "id": "runtime/function_arguments_left_to_right",
  "kind": "runtime",
  "origin": "OpenC Standard Draft 0.10 validation/runtime/function_arguments_left_to_right",
  "schema": "openc.fixture.v1",
  "source_files": [
    "conformance/fixtures/runtime/function_arguments_left_to_right/main.p"
  ]
}
