{
  "active_rules": [
    "OPENC-CLEANUP-LIFO-001",
    "OPENC-CLEANUP-NESTED-001"
  ],
  "evidence_state": "EXECUTED_PASS_WINDOWS_X86_64_1_0",
  "expected": {
    "class": "valid",
    "edition": "OpenC Core 1.0 Current",
    "environment": "hosted",
    "expected": {
      "result": "accept",
      "stdout": [
        "inner-last",
        "inner-first",
        "outer"
      ]
    },
    "fixture_kind": "source",
    "mode": "module",
    "name": "scope_nested_lifo",
    "profile": "standard",
    "rules": [
      "OPENC-CLEANUP-LIFO-001",
      "OPENC-CLEANUP-NESTED-001"
    ]
  },
  "id": "valid/scope_nested_lifo",
  "kind": "valid",
  "origin": "OpenC Standard Draft 0.10 validation/valid/scope_nested_lifo",
  "schema": "openc.fixture.v1",
  "source_files": [
    "conformance/fixtures/valid/scope_nested_lifo/main.p"
  ]
}
