{
  "active_rules": [
    "OPENC-PTR-ADDRESSABLE-001",
    "OPENC-PTR-DEREF-001",
    "OPENC-PTR-DERIVED-NONOWNING-001",
    "OPENC-PTR-PROVENANCE-001",
    "OPENC-UNSAFE-BOUNDARY-001"
  ],
  "evidence_state": "EXECUTED_PASS_WINDOWS_X86_64_1_0",
  "expected": {
    "class": "valid",
    "edition": "OpenC Core 1.0 Current",
    "environment": "hosted",
    "expected": {
      "result": "accept"
    },
    "fixture_kind": "source",
    "name": "unsafe_pointer",
    "profile": "standard",
    "rules": [
      "OPENC-PTR-ADDRESSABLE-001",
      "OPENC-PTR-DEREF-001",
      "OPENC-PTR-DERIVED-NONOWNING-001",
      "OPENC-PTR-PROVENANCE-001",
      "OPENC-UNSAFE-BOUNDARY-001"
    ]
  },
  "id": "valid/unsafe_pointer",
  "kind": "valid",
  "origin": "OpenC Standard Draft 0.10 validation/valid/unsafe_pointer",
  "schema": "openc.fixture.v1",
  "source_files": [
    "conformance/fixtures/valid/unsafe_pointer/main.p"
  ]
}
