{
  "active_rules": [
    "OPENC-LITERAL-INTEGER-001",
    "OPENC-LITERAL-RANGE-001",
    "OPENC-NUM-LITERAL-CONTEXT-001"
  ],
  "evidence_state": "EXECUTED_PASS_WINDOWS_X86_64_1_0",
  "expected": {
    "class": "valid",
    "edition": "OpenC Core 1.0 Current",
    "environment": "hosted",
    "expected": {
      "result": "accept"
    },
    "fixture_kind": "source",
    "mode": "module",
    "name": "integer_literal_exact_context",
    "profile": "standard",
    "rules": [
      "OPENC-LITERAL-INTEGER-001",
      "OPENC-LITERAL-RANGE-001",
      "OPENC-NUM-LITERAL-CONTEXT-001"
    ]
  },
  "id": "valid/integer_literal_exact_context",
  "kind": "valid",
  "origin": "OpenC Standard Draft 0.10 validation/valid/integer_literal_exact_context",
  "schema": "openc.fixture.v1",
  "source_files": [
    "conformance/fixtures/valid/integer_literal_exact_context/main.p"
  ]
}
