{
  "active_rules": [
    "OPENC-NUM-ADD-001",
    "OPENC-NUM-AUTHORITY-001",
    "OPENC-NUM-COMPOUND-001"
  ],
  "evidence_state": "EXECUTED_PASS_WINDOWS_X86_64_1_0",
  "expected": {
    "class": "runtime",
    "edition": "OpenC Core 1.0 Current",
    "environment": "hosted",
    "expected": {
      "result": "accept"
    },
    "fixture_kind": "runtime",
    "mode": "module",
    "name": "checked_addition",
    "profile": "standard",
    "rules": [
      "OPENC-NUM-ADD-001",
      "OPENC-NUM-AUTHORITY-001",
      "OPENC-NUM-COMPOUND-001"
    ]
  },
  "id": "runtime/checked_addition",
  "kind": "runtime",
  "origin": "OpenC Standard Draft 0.10 validation/runtime/checked_addition",
  "schema": "openc.fixture.v1",
  "source_files": [
    "conformance/fixtures/runtime/checked_addition/main.p"
  ]
}
