{
  "active_rules": [
    "OPENC-TARGET-NOARBITRARY-001",
    "OPENC-TARGET-PTRPROV-001"
  ],
  "evidence_state": "EXECUTED_PASS_WINDOWS_X86_64_1_0",
  "expected": {
    "class": "runtime",
    "edition": "OpenC Core 1.0 Current",
    "environment": "hosted",
    "expected": {
      "result": "target_fault",
      "rule": "OPENC-TARGET-PTRPROV-001"
    },
    "fixture_kind": "runtime",
    "mode": "module",
    "name": "pointer_provenance_target_fault",
    "profile": "standard",
    "rules": [
      "OPENC-TARGET-NOARBITRARY-001",
      "OPENC-TARGET-PTRPROV-001"
    ]
  },
  "id": "runtime/pointer_provenance_target_fault",
  "kind": "runtime",
  "origin": "OpenC Standard Draft 0.10 validation/runtime/pointer_provenance_target_fault",
  "schema": "openc.fixture.v1",
  "source_files": [
    "conformance/fixtures/runtime/pointer_provenance_target_fault/main.p"
  ]
}
